link,account,timestamp,tweetText,reply,retweet,like
https://twitter.com/MergiS/status/1448992755951222793,@MergiS,2021-10-15T12:42:48.000Z,OMG!!,1,0,4
https://twitter.com/thecrypto_dave/status/1448992676003655686,@thecrypto_dave,2021-10-15T12:42:29.000Z,"#quack",0,0,5
https://twitter.com/NonFungibleNat/status/1448992585398239233,@NonFungibleNat,2021-10-15T12:42:07.000Z,If I had the ETH I’d buy that bowler hat ape from you right now.,0,0,6
https://twitter.com/DiddyBopAllDay/status/1448989936699510789,@DiddyBopAllDay,2021-10-15T12:31:36.000Z,Big ngmi,0,0,4
https://twitter.com/anthdm/status/1448989306027220992,@anthdm,2021-10-15T12:29:06.000Z,"If you are priced out for a @coolcatsnft or a  @BoredApeYC , you should definitely grab yourself a @Deadfellaznft. Change my mind.",14,24,144
https://twitter.com/seth_silvani/status/1448988773291859972,@seth_silvani,2021-10-15T12:26:59.000Z,Value is subjective. The Mona Lisa doesn't mean shit in terms of actual utility. Staring at that isnt gonna put food on a table. I value art almost exactly 0,5,0,55
https://twitter.com/Benjiels47/status/1448987804277555203,@Benjiels47,2021-10-15T12:23:08.000Z,Good shout.. not quite pixilated enough though,0,0,5
https://twitter.com/TheRealDealz7/status/1448986732825829376,@TheRealDealz7,2021-10-15T12:18:52.000Z,"Too much to handle for one person, Gonna have to send me the merch ape for safekeeping",0,0,7
https://twitter.com/Deanik_k/status/1448985885194735616,@Deanik_k,2021-10-15T12:15:30.000Z," ",3,1,25
https://twitter.com/nfamio/status/1448981068770463744,@nfamio,2021-10-15T11:56:22.000Z,"Looks rare ",14,74,248
https://twitter.com/YaristotleGMI/status/1448979107576954886,@YaristotleGMI,2021-10-15T11:48:34.000Z,"GM to all my  @BoredApeYC  #BAYC family for making me feel welcome in the NFT space.   Gratitude time! Who’s someone you appreciate in the NFT space? Tag them below and drop them a gratitude banana ",1,0,10
https://twitter.com/RDWizard1/status/1448978223241605126,@RDWizard1,2021-10-15T11:45:03.000Z,"When  @BoredApeYC  is your goal and the floor keeps rising, chasing goals! SMH Todays entry price is  36.5E ($138,090.45)",1,1,8
https://twitter.com/EveryNFT_me/status/1448968008957939715,@EveryNFT_me,2021-10-15T11:04:28.000Z,"Love the diamond teeth, dayum.",0,0,5
https://twitter.com/ctgoat/status/1448967852183068677,@ctgoat,2021-10-15T11:03:51.000Z,About 2.6 millions,0,0,5
https://twitter.com/Xavimm/status/1448967604417216512,@Xavimm,2021-10-15T11:02:52.000Z,Step by step    @antonitudisco  @MyCurioCards    @artblocks_io  by  @REAS  @Ness_Graphics  (soon)   @XCOPYART  @BoredApeYC    Punks  @larvalabs,1,1,10
https://twitter.com/ilyakazakov/status/1448963849890279425,@ilyakazakov,2021-10-15T10:47:56.000Z,"NFT Party Guests: @coolcatsnft  — 6,  @robotosNFT  — 2,  @BoredApeYC  — 2,  @AxieInfinity  — 2,  @meta_heroes  — 2,  @KidPunksNFT  — 2,  @cryptoadzNFT  — 2,  @FangGangNFT ,  @NFTSiblings ,  @CleverGirlsNFT  and others  41 unique collections",6,8,46
https://twitter.com/hodl_CT/status/1448963039659761694,@hodl_CT,2021-10-15T10:44:43.000Z,"Would love to see the  @BoredApeYC Movie  Am sure it’ll be dope ",29,14,18
https://twitter.com/VVingsss/status/1448954201766187016,@VVingsss,2021-10-15T10:09:36.000Z,Lets re-tweet this and get some opinions! Would love to see what everyone thinks!  @MyCurioCards  @BoredApeYC  @GutterCatGang,0,0,5
https://twitter.com/zark3d/status/1448946222639747086,@zark3d,2021-10-15T09:37:54.000Z,bayc shaking rn,1,0,6
https://twitter.com/tuffina2021/status/1448943776009949234,@tuffina2021,2021-10-15T09:28:10.000Z,"I'm keen on red fur and boho hats, myself...those heart glasses and pipe just pull it all together!",1,0,5
https://twitter.com/DeafKing_/status/1448942957780815874,@DeafKing_,2021-10-15T09:24:55.000Z,. @beeegeeebeee  could have bought and wiped out  @BoredApeYC . But naaah he f w  @ApeGangNFT .,4,8,64
https://twitter.com/PEL0L0C0/status/1448942525968945162,@PEL0L0C0,2021-10-15T09:23:12.000Z,I like it. that jacket is S-Weeeet! I have a Mutant and I have also found a great escape into a smaller and more  @SurrealsNFT  project with a community passionate about the art and the artist.,1,0,6
https://twitter.com/l3xclim/status/1448942407718895619,@l3xclim,2021-10-15T09:22:44.000Z,The Token #11.,1,0,5
https://twitter.com/Laascold/status/1448940047307132938,@Laascold,2021-10-15T09:13:21.000Z,"As the day goes by...the dream of owning a  @BoredApeYC  feels further and further ",1,0,8
https://twitter.com/JeffKCollins/status/1448931120217616385,@JeffKCollins,2021-10-15T08:37:53.000Z,"Yeah the community is great, the team is genius and all that but the best thing about joining  @BoredApeYC  is that you finally learn how to spell ""yacht"".",3,0,7
https://twitter.com/NewgateTR/status/1448926014130753552,@NewgateTR,2021-10-15T08:17:36.000Z," @BoredApeYC   #5199, birkaç saat önce yaklaşık 1,6 milyon dolara satıldı. ",1,0,10
https://twitter.com/TheOneNFT/status/1448925089416712192,@TheOneNFT,2021-10-15T08:13:55.000Z,"November: I want a divorce. Keep the house, but I am taking my ape.",1,0,8
https://twitter.com/just_som_artist/status/1448922346799222812,@just_som_artist,2021-10-15T08:03:01.000Z,@Postersandtoys  @AlfieTao  These are my first 2  @BoredApeYC  #Derivatives of  @Postersandtoys  ape. I know that I'm not a popular artist but I'm thinking about doing an #NFTauction on  @opensea . Or should I use  @objktcom  for the #nftauauction ? Let me know what you think.Than you.,2,0,5
https://twitter.com/nftrancher/status/1448920402005147650,@nftrancher,2021-10-15T07:55:18.000Z," ",0,0,5
https://twitter.com/mad_canvas/status/1448916123001389056,@mad_canvas,2021-10-15T07:38:17.000Z,Apple Watch for sure!,0,0,7
https://twitter.com/ellaorten/status/1448911495237038087,@ellaorten,2021-10-15T07:19:54.000Z,Herb!!!!,1,0,7
https://twitter.com/LegendsOfAurae/status/1448910426964639744,@LegendsOfAurae,2021-10-15T07:15:39.000Z,"Will people one day wear t-shirts with their  @OrcsOfOrakion  ""Green""chip NFT? Will they connect like the  @BoredApeYC   does, have real life fantasy cosplay meetings and hang out together? would be pretty dope for sure :)  #NFT #NFTCommunity #NFTcollections",4,13,34
https://twitter.com/Rybott/status/1448904945009233925,@Rybott,2021-10-15T06:53:52.000Z,420.69 eth or don’t talk.  @larvalabs  @BoredApeYC   https://opensea.io/assets/0xa3b7cee4e082183e69a03fc03476f28b12c545a7/3376/…  #chillfrogsnft #frogtober,4,5,17
https://twitter.com/mrblocktw/status/1448901693324742658,@mrblocktw,2021-10-15T06:40:57.000Z,sweeping  @BoredApeYC,18,13,280
https://twitter.com/NudeYogaGirl/status/1448896987751976962,@NudeYogaGirl,2021-10-15T06:22:15.000Z,,0,0,5
https://twitter.com/whatsupwally/status/1448882026224914436,@whatsupwally,2021-10-15T05:22:48.000Z,Shout out all the vegans!,1,0,4
https://twitter.com/Blitnaut/status/1448880738833559553,@Blitnaut,2021-10-15T05:17:41.000Z,Come to @BullieverIsland,1,5,5
https://twitter.com/lucatheastrona1/status/1448878233806540802,@lucatheastrona1,2021-10-15T05:07:44.000Z,What’s coming soon from Exzidia.. -Vizoooo -Amarok the alien fader  -Halloween in Exzidia  -space creatures (x  @9george   -Acid street -  @LazyLionsNFT   derivatives  -  @BoredApeYC  derivatives - Avio figurine  @EvanModel3D   … and more  after that  #NFTCommunity,1,3,6
https://twitter.com/kdevpls/status/1448877759397257234,@kdevpls,2021-10-15T05:05:51.000Z,"Hella proud of my boi here, who has been CRUSHING every trade.   Jumped to a mutant with me.  #ApeFollowApe  #BAYC #MAYC  @BoredApeYC   It's after midnight so #FF",1,0,10
https://twitter.com/OneTrippyPlanet/status/1448876025216073729,@OneTrippyPlanet,2021-10-15T04:58:57.000Z,LFG!   #unsig #BAYC #MAYC,1,0,8
https://twitter.com/SirSnapback_eth/status/1448875891468083205,@SirSnapback_eth,2021-10-15T04:58:25.000Z,Best of luck to you and the rest of your  @BoredApeYC  community. Wish nothing but the best for you and your project.,0,0,8
https://twitter.com/dvnc_00/status/1448864882120544256,@dvnc_00,2021-10-15T04:14:41.000Z,Daymnnn.. is that an unsig in the background? Yep you're gmi,0,0,7
https://twitter.com/tonihotdog/status/1448864871999631362,@tonihotdog,2021-10-15T04:14:38.000Z,Hi Capt,1,2,12
https://twitter.com/TheMatthewA/status/1448864487927271424,@TheMatthewA,2021-10-15T04:13:07.000Z,"That's why I aped into things like  @punkscomic  (opp to create shared narrative around the whole space), it's why I joined  @FWBtweets , it's why I plan to long term hold projects like  @BoredApeYC  and it's why I want to onboard more people to the space.",1,0,5
https://twitter.com/d20_eth/status/1448859738826027054,@d20_eth,2021-10-15T03:54:14.000Z,Mushroom Gang   @BoredApeYC  @WoodiesNFT  #BoredApeYachtClub,1,4,63
https://twitter.com/kensavage/status/1448859599319281709,@kensavage,2021-10-15T03:53:41.000Z,Pics or it didn’t happen,0,0,5
https://twitter.com/bronzbeard25/status/1448857034636468229,@bronzbeard25,2021-10-15T03:43:30.000Z,,0,1,7
https://twitter.com/SalteryLake/status/1448853064849391629,@SalteryLake,2021-10-15T03:27:43.000Z,"Lets see...  For  @NFT_NYC  so far, I have RSVP's to an  @AxieInfinity  event, 2  @BoredApeYC  events, 2  @CyberKongz  events and 3  @RealSupDucks  events.  This is gonna be EPIC!",3,3,22
https://twitter.com/Inaros_SF/status/1448850296810188815,@Inaros_SF,2021-10-15T03:16:43.000Z,"I have just had to say goodbye to the prettiest ape in the Metaverse, Ape#354. It's been one hell of a journey since mint with it's highs and lows. I thank the founders of  @BoredApeYC  and their amazing team for creating this truly life-changing event for me, I'll be back...",3,2,39
https://twitter.com/sicko_ape/status/1448832387354292224,@sicko_ape,2021-10-15T02:05:33.000Z,Just another boring day  @BoredApeYC @thehundreds  #BoredApeYachtClub #BAYC #BoredApe,2,0,15
https://twitter.com/a_raving_ape/status/1448831512208678914,@a_raving_ape,2021-10-15T02:02:05.000Z,"If the  @BoredApeYC  Doggos keeps dropping, gonna have to open a no-kill animal shelter in my wallet ",0,0,7
https://twitter.com/JustJamesMedic/status/1448828452434595843,@JustJamesMedic,2021-10-15T01:49:55.000Z,"Bruh, I want Flavors themed poker",0,2,10
https://twitter.com/Jobby_Bonez/status/1448812576305975297,@Jobby_Bonez,2021-10-15T00:46:50.000Z,"#MAYC  @BoredApeYC",0,0,3
https://twitter.com/boat_eth/status/1448807586258636805,@boat_eth,2021-10-15T00:27:00.000Z,Doing great,0,0,6
https://twitter.com/TheChainGamer/status/1448802524174110724,@TheChainGamer,2021-10-15T00:06:53.000Z,"I found out about  @BullsOnTheBlock  soon after I joined the  @BoredApeYC . Minted 22 (still hold 12).  Folks who followed #BOTB know it hasn't been a smooth ride! But, it's been awesome to see the community rise up to the challenge.   The Bulls are evolving! I, for one, am excited!",1,2,38
https://twitter.com/sammydub17/status/1448802425070968832,@sammydub17,2021-10-15T00:06:30.000Z,Welcome!,0,0,5
https://twitter.com/0xKelly/status/1448800440213114881,@0xKelly,2021-10-14T23:58:37.000Z,Fun times  @cityapez  repping  @BoredApeYC  all day Love my  @veefriends  fam!  https://instagram.com/p/CVBpMkHAh9e/?utm_source=ig_web_button_share_sheet…,1,3,7
https://twitter.com/SarahGen94/status/1448798978439479300,@SarahGen94,2021-10-14T23:52:48.000Z,We love you and this! #couplegoals #koalagang  @dyl241,0,2,6
https://twitter.com/ChrisJourdan/status/1448798388179410944,@ChrisJourdan,2021-10-14T23:50:27.000Z,Legend.  @LanceTheDon717  is legendary and will always be part of BAYC lore,0,1,2
https://twitter.com/Halfmastodon/status/1448790673214173216,@Halfmastodon,2021-10-14T23:19:48.000Z,Toadz budz gonna be bored together,0,3,13
https://twitter.com/fredthe5th/status/1448786754081746944,@fredthe5th,2021-10-14T23:04:13.000Z,"A great thread…now we just need to figure out what they will buy when they get here.. @Animetas1  (great project and track record good entry price)  @0n1Force  (killer art, team, and community mid entry)  @BoredApeYC  (blue chip)   Probably a mix I suppose.",1,1,4
https://twitter.com/Abraham_L_L/status/1448785313216749572,@Abraham_L_L,2021-10-14T22:58:30.000Z,"(3/10) We were early getting in on the  @BoredApeYC . Here’s  @F4ntast1cMrF0x  introducing us to apes on May 2nd, when they were trading at 0.8 eth. Held until today that's about a 4500% gain just in eth terms.",1,1,7
https://twitter.com/jpegloser/status/1448777459701202951,@jpegloser,2021-10-14T22:27:18.000Z,"Seeing a lot of forced fud from  @BoredApeYC  owners about the similarities between some Meka's. The reality is all generative projects will have pieces with similar designs. But not bayc, they're all unique right? ",7,11,56
https://twitter.com/Pizza_Later/status/1448776978249682946,@Pizza_Later,2021-10-14T22:25:23.000Z,He's the best.,0,1,11
https://twitter.com/sandergansen/status/1448776512140988421,@sandergansen,2021-10-14T22:23:32.000Z,"And I also love the communities as  @BoredApeYC ,  @fame_ladies  & #StonedApez. ",3,2,9
https://twitter.com/DotWorkByDavid/status/1448776378468511745,@DotWorkByDavid,2021-10-14T22:23:00.000Z,"@DotWorkByDavid  @TrippyBunnyNFT  @0x_fxnction  @BoredApeYC  ",9,14,103
https://twitter.com/peltzm/status/1448776178995810305,@peltzm,2021-10-14T22:22:12.000Z,Lmao wgmi,0,0,5
https://twitter.com/bryanbrinkman/status/1448776127066017794,@bryanbrinkman,2021-10-14T22:22:00.000Z,"Quick shout-out to  @paperdstudio  for the custom toad based on my  @BoredApeYC . A fun perk of owning his ""Bored to Death"" NFT. A gift that keeps on giving.",7,4,69
https://twitter.com/SaintMG1/status/1448771278081511430,@SaintMG1,2021-10-14T22:02:44.000Z,Your Welcome Bro!  Thank you for letting me use yours  @BoredApeYC   to create an Art for such a necessary and incredible space   #NFTs #BAYC #Digitalart #boredapeart #renaissancepainting #NFTs #NFTCommunity #NFTtalk #NFTespañol #Twitternft,0,2,9
https://twitter.com/Jamie09013291/status/1448769939318493184,@Jamie09013291,2021-10-14T21:57:25.000Z," ",1,2,8
https://twitter.com/420AxieFarmer/status/1448766599788441605,@420AxieFarmer,2021-10-14T21:44:08.000Z,Ayyyyye,0,0,4
https://twitter.com/outerlumen/status/1448761737205927945,@outerlumen,2021-10-14T21:24:49.000Z,Two things I don’t know how to answer since NFTs :  “What do you do for work?”   “What time do you start work?”   Yes that’s my  @BoredApeYC  x  @bobbyhundreds  hoodie next to a Marcel Duchamp urinal   #NFTCommunity #nftcollector #NFTfamily #NFTs,2,2,10
https://twitter.com/GiftedNFTsauce/status/1448759798401490945,@GiftedNFTsauce,2021-10-14T21:17:07.000Z,"So glad I’m finally in a blue chip NFT  @BYOPills  , I missed  @BoredApeYC  , @coolcatsnft but I know Apostles are going to make up for all of that. Can’t wait to see all the things this team has to show us :)",2,0,5
https://twitter.com/Imperium_Crypto/status/1448755763997028358,@Imperium_Crypto,2021-10-14T21:01:05.000Z,Frens for the win,0,0,9
https://twitter.com/MarsCatsVoyage/status/1448752552854556676,@MarsCatsVoyage,2021-10-14T20:48:19.000Z,"Where is your suited cat? ",1,0,18
https://twitter.com/SpaceheadsSaga/status/1448751230214410244,@SpaceheadsSaga,2021-10-14T20:43:04.000Z,Every day I see a mutant that's cooler than the last. It will be hard to top this one.,1,1,4
https://twitter.com/Keith3W/status/1448749536139112455,@Keith3W,2021-10-14T20:36:20.000Z,Will do. Cheers,0,0,4
https://twitter.com/chanattack79/status/1448746620586180610,@chanattack79,2021-10-14T20:24:45.000Z,"Also check out  @MekaVerse  and  @KoalaAgencyNFT    ",0,0,6
https://twitter.com/BrightAvian/status/1448743623604981773,@BrightAvian,2021-10-14T20:12:50.000Z,"Pretty certain that punks,  @BoredApeYC ,  @artblocks_ , and mutants will be the only ones of those 10 left in the top spots in 1–2 months... do with that prediction what you want! Hope it helps! <3",3,2,17
https://twitter.com/Trevor4ever210/status/1448741616802574342,@Trevor4ever210,2021-10-14T20:04:52.000Z,"rainbow suspenders are the best ",0,0,6
https://twitter.com/kolzahn/status/1448738006848917513,@kolzahn,2021-10-14T19:50:31.000Z,Some of the best projects on OS in one thread. Love it,0,0,6
https://twitter.com/deezcoinzNFT/status/1448737437102919681,@deezcoinzNFT,2021-10-14T19:48:15.000Z,"sup sup ",1,0,7
https://twitter.com/cuseNFT/status/1448737351262511105,@cuseNFT,2021-10-14T19:47:55.000Z,"So sick! Let’s gooooo! ",0,0,9
https://twitter.com/joshhart/status/1448737344966778880,@joshhart,2021-10-14T19:47:53.000Z,Welcome to the gang #8748  @BoredApeYC,117,69,1356
https://twitter.com/MincoETH/status/1448734956990066693,@MincoETH,2021-10-14T19:38:24.000Z,"You can execute speculative buys on what the next  @BoredApeYC  will be, sure, but if you have the ETH you’re better off just buying an ape.   Change my mind.",2,0,12
https://twitter.com/comrades_NFT/status/1448734465748987918,@comrades_NFT,2021-10-14T19:36:27.000Z,"“I’ve never heard of  @BoredApeYC  or @coolcatsnft” ",5,10,14
https://twitter.com/booshpanda/status/1448733437355986945,@booshpanda,2021-10-14T19:32:22.000Z,Looking for an NFT to buy in this lull? look hard at any projects that are hosting something for http://NFT.NYC. it shows they have their stuff together and are delivering. @TopDogBeachClub @RoyalSocietyOP @AnonymiceNFT @BoredApeYC   @GutterCatGang Who else am I missing?,1,0,5
https://twitter.com/CryptoBookies_/status/1448733024141647880,@CryptoBookies_,2021-10-14T19:30:43.000Z,Bruv im right here,2,0,4
https://twitter.com/Cryptalker2021/status/1448728061705441282,@Cryptalker2021,2021-10-14T19:11:00.000Z,"Hodling  @goatlodge  is a smart move.  Why?  Same artist who made  @BoredApeYC  and  @SVSNFT  is behind it.   @migwashere2   Would it achieve the same success as BAYC? Time will only tell. For now though, the art looks dope af and its lfg!",3,5,22
https://twitter.com/Saurfeng/status/1448711675213910020,@Saurfeng,2021-10-14T18:05:53.000Z,So hyped about how my first  @BoredApeYC  derivative came out for  @HalfDecent_    The force is strong with this one! #nftart #NFTartist,30,28,289
https://twitter.com/allnick/status/1448711669031518209,@allnick,2021-10-14T18:05:52.000Z,"If you see these stuck around NYC, just remember: IT WASNT ME @BoredApeYC",20,20,221
https://twitter.com/connorpegsart/status/1448709174758621188,@connorpegsart,2021-10-14T17:55:57.000Z,@jaypegsautomart  please support,0,0,7
https://twitter.com/GooglyEyeNFT/status/1448699968844357637,@GooglyEyeNFT,2021-10-14T17:19:22.000Z,"Wow, #BoredApes.. So much cash.. How about #googlyeyes, #thingswithfaces  The next big thing, ha...  @BoredApeYC #nft #NFTs #nftphotography #nftcommunity #nftcollector #NFTmarketplace #opensea  https://opensea.io/assets/matic/0x2953399124f0cbb46d2cbacd8a89cf0599974963/18034397506098658768922245428857106025112124768350525510332206734716212084737/…",0,1,5
https://twitter.com/NotoriousMEG_/status/1448699437950373895,@NotoriousMEG_,2021-10-14T17:17:16.000Z,This was just on  @FoxBusiness . Probably nothing.  @BoredApeYC   @GutterCatGang,28,114,591
https://twitter.com/VonFrontin/status/1448697939296149512,@VonFrontin,2021-10-14T17:11:18.000Z,How many other stories like Clarence do we have from 5 years….I mean months ago?,0,0,4
https://twitter.com/RoninDaCC/status/1448693083495874564,@RoninDaCC,2021-10-14T16:52:01.000Z,"Out buying a pair of  @Nike  AF1’s for  @wolfdoglives_  to customize for me…   Ended up talking to one of the employees about my apes,  @BoredApeYC  and my NFT buying strategy.   Shits getting real.",0,1,5
https://twitter.com/MrBSN868/status/1448693043482214404,@MrBSN868,2021-10-14T16:51:51.000Z,Lots of fun meeting people on  @isotile Dancing while we chat lol I have been picking up #avatars on  @opensea You can display your favorites in the #isotile #Metaverse @thecryptopunks @BoredApeYC,2,4,11
https://twitter.com/Curty_Nft_World/status/1448691629418708992,@Curty_Nft_World,2021-10-14T16:46:14.000Z,"It's the most wonderful time of the year for a Mutant Ape!  @BoredApeYC  #ApefollowApe  Need some friends, new in the community :)",2,1,19
https://twitter.com/whyarewehere42/status/1448688408759504899,@whyarewehere42,2021-10-14T16:33:26.000Z,All the fake  @BoredApeYC  people doing fake twitter giveaways,1,0,5
https://twitter.com/goodboygoodtime/status/1448683589017559040,@goodboygoodtime,2021-10-14T16:14:17.000Z,@jaypegsautomart  or irrelevance.,0,0,6
https://twitter.com/ajithchelsea/status/1448682460884123649,@ajithchelsea,2021-10-14T16:09:48.000Z,Hey Nate... Please check out  @Danuki_Dojo We provide 100%of royalties to the community. The royalties are 15%. We are 6666 cute Danuki's... And each Danuki in the first week gets 0.25 SOL. We have over 17k SOL Volume.  Please check us out  @Danuki_Dojo  @Danuki_Rewards ....,41,38,53
https://twitter.com/MikeJemo/status/1448678503277285377,@MikeJemo,2021-10-14T15:54:04.000Z,"Almost flipped my way up to a  @BoredApeYC   ",2,0,27
https://twitter.com/NoobGodIII/status/1448678134384103434,@NoobGodIII,2021-10-14T15:52:37.000Z,Looking fly as hell walla fam,0,1,6
https://twitter.com/robviglione/status/1448677841923559427,@robviglione,2021-10-14T15:51:27.000Z,You guys should help us roll out the  @horizenglobal  #DeFi ecosystem and earn lots of precious $ZEN that way! Maybe some #fodl action,1,7,34
https://twitter.com/bence_m_varga/status/1448675843530706956,@bence_m_varga,2021-10-14T15:43:30.000Z,Your logic is flawed: ( I do not own Mekas or BAYC),4,1,35
https://twitter.com/KoalaAgencyNFT/status/1448675335743148035,@KoalaAgencyNFT,2021-10-14T15:41:29.000Z,"THIS kind of thing is definitely what we love most about our community    You guys look FANTASTIC! we are so thrilled to be included in your journey ",0,2,11
https://twitter.com/Valuemancer/status/1448674888370163719,@Valuemancer,2021-10-14T15:39:43.000Z,"How about  @MekaVerse ,  @Sorasdreamworld  and  @jaypegsautomart  ",0,0,6
https://twitter.com/gooseygoo5/status/1448674576007720967,@gooseygoo5,2021-10-14T15:38:28.000Z,@jaypegsautomart,0,0,6
https://twitter.com/DApeWives/status/1448672734360244230,@DApeWives,2021-10-14T15:31:09.000Z,We can also do #apefollowapewives   @ReeseW,1,1,7
https://twitter.com/drew_osumi/status/1448671981784731649,@drew_osumi,2021-10-14T15:28:10.000Z,@jaypegsautomart,0,0,6
https://twitter.com/BennyBBuckets/status/1448668582083182592,@BennyBBuckets,2021-10-14T15:14:39.000Z,He’s appreciated!!!!,1,0,5
https://twitter.com/adamsbucket/status/1448668491398197254,@adamsbucket,2021-10-14T15:14:17.000Z,"Not an ape! Life goals are ape, house, kids in that order! But you get a follow cuz I love all my Ape,  @CryptoDadsNFT , NFT, crypto homies!!",1,1,9
https://twitter.com/BequalsINGS/status/1448668380790235145,@BequalsINGS,2021-10-14T15:13:51.000Z,I have two more to send you,0,0,4
https://twitter.com/barkeep1347/status/1448668293699616768,@barkeep1347,2021-10-14T15:13:30.000Z," ",0,0,6
https://twitter.com/JoeMangrum/status/1448668266843492359,@JoeMangrum,2021-10-14T15:13:24.000Z,and I gained a cool cat and a mutant as well as basically paid off my house.,1,0,5
https://twitter.com/ponderware/status/1448658167357792275,@ponderware,2021-10-14T14:33:16.000Z,"We’ve also done some fun things not on the roadmap like lootprints and MoonCatNameService ",2,0,12
https://twitter.com/dlrowehtfoweiv/status/1448657276605112330,@dlrowehtfoweiv,2021-10-14T14:29:44.000Z," ",1,0,4
https://twitter.com/TheSkeeva/status/1448656141274136576,@TheSkeeva,2021-10-14T14:25:13.000Z,Another exciting news! Happy to share my piece for  @MrsSudoku  v2 collection! And guess what? This is a  @BoredApeYC  derivative...kinda! yoooo #BAYC,8,11,115
https://twitter.com/floralfootball/status/1448653628365893632,@floralfootball,2021-10-14T14:15:14.000Z,The  @BoredApeYC  has their biggest challenge so far coming up:  Owning a bar in Miami that doesn’t go out of business.,0,1,6
https://twitter.com/lindquest_/status/1448652629265948674,@lindquest_,2021-10-14T14:11:16.000Z,"So many #MekaHaters in this space recently. Why so bitter? Let’s celebrate a successful  @mekaverse  launch and all the attention it brings to the NFT/Crypto space ",6,0,10
https://twitter.com/DeFiFUDDestroy/status/1448652576665206786,@DeFiFUDDestroy,2021-10-14T14:11:03.000Z,what a network to participate in! #node #operation THE MOST FULL NODES IN CRYPTO! #crypto  @horizenglobal  $ZEN #horizen #zendoo #decentralized #secure #distributed  https://horizen.io/node-hosting/,0,5,17
https://twitter.com/nftcryptomoney/status/1448650231386570752,@nftcryptomoney,2021-10-14T14:01:44.000Z,"The Bull Run of all Bull Runs is coming....I believe the NFT market is about to have a big run with the A level projects moving first... @BoredApeYC , Punks, etc and then followed by B level.. @LazyLionsNFT ,  @bears_deluxe ,  @CyberKongs , etc and then followed by great low floor...",1,1,8
https://twitter.com/doreencummings_/status/1448649765810434048,@doreencummings_,2021-10-14T13:59:53.000Z,BAYC cameo!  @BoredApeYC  @ABugTravelsFar,1,2,9
https://twitter.com/ABugTravelsFar/status/1448648673903013914,@ABugTravelsFar,2021-10-14T13:55:33.000Z,"@BoredApeYC  friends, my #8682 makes a cameo in Book 1 of A Bug Travels Far! #raretoken January drops! Stay tuned!",0,2,5
https://twitter.com/obchakevich_/status/1448647926910099465,@obchakevich_,2021-10-14T13:52:35.000Z,"Smell of the Rich Ape parfum ( concept) #BAYC 5423, 3415 by  @QualityNames_   @BoredApeYC    A parfumé for the real owner of cool ape. BAYC is more than an NFT, more than a community.   *watch with sound",8,4,13
https://twitter.com/KonradProbst/status/1448644630812119043,@KonradProbst,2021-10-14T13:39:29.000Z,"Hate to break it to you: not all of your avatars are gonna be like @coolcatsnft  @BoredApeYC  @larvalabs  cryptopunks.   Also your avatar is fucking ugly, don’t tell me that you really “love the art”. Which art?",4,0,8
https://twitter.com/PaInIaMs/status/1448644610343923713,@PaInIaMs,2021-10-14T13:39:24.000Z,"#FLOKI Growing together is what's it all about  @RealFlokiInu",0,1,13
