link,account,timestamp,tweetText,reply,retweet,like
https://twitter.com/kylasbitch/status/1445840564256133121,@kylasbitch,2021-10-06T19:57:07.000Z,Noise fur. Easy.,0,0,7
https://twitter.com/byswickie/status/1445839276311080963,@byswickie,2021-10-06T19:52:00.000Z,"They can also use their rights and do something with it ",3,1,10
https://twitter.com/shok_eth/status/1445835400635764739,@shok_eth,2021-10-06T19:36:36.000Z,Gearing up for Ape Fest. Who’s got swag to trade?  @BoredApeYC  #bayc #apefest,3,1,25
https://twitter.com/JubzCollect/status/1445833297775390723,@JubzCollect,2021-10-06T19:28:15.000Z,"Receiving WETH offers on your NFTs day after day, week after week is a really good indicator of the project strength  some good exemples are: (cryptopunks,meebits, @BoredApeYC , @coolcatsnft,  @CyberKongz ,  @veefriends ,  @MyCurioCards ,  @RealSupDucks ,  @creatureNFT  etc.)",1,0,10
https://twitter.com/jmt_nft/status/1445832986780319746,@jmt_nft,2021-10-06T19:27:00.000Z,Exactly. Move the apes from short term to long term money. Then announce. This is a multi-year project. And I’m very long.,1,0,9
https://twitter.com/emils_eth/status/1445831754938339329,@emils_eth,2021-10-06T19:22:07.000Z,"#BAYC  @BoredApeYC",0,0,8
https://twitter.com/boo_el_prez/status/1445831167693918213,@boo_el_prez,2021-10-06T19:19:47.000Z,PSA: I love the  @BoredApeYC  Bathroom wall.,25,55,435
https://twitter.com/jlong2356/status/1445829749125926914,@jlong2356,2021-10-06T19:14:09.000Z,The  @BoredApeYC  members getting to fixated with the floor...lots move in the mid tiers daily....people have to realize when the floor is 40 ETH+...it takes a lot of ETH to sweep it....big $ can go move other collection in 5-10 range much easier...RELAX...you are in TIER 1 #BAYC,18,18,275
https://twitter.com/B0TTLE_R0CKET/status/1445826033412939782,@B0TTLE_R0CKET,2021-10-06T18:59:23.000Z," I see you also have great friends",1,0,7
https://twitter.com/rocketmanNFT/status/1445825802977914880,@rocketmanNFT,2021-10-06T18:58:28.000Z,,1,0,6
https://twitter.com/ChuckieDang/status/1445825660325269505,@ChuckieDang,2021-10-06T18:57:54.000Z,"1)  @Pumpkittens  already have a 8k $ftm floor 2)  @fOracle_  Pepe Tarots almost sold out day 1, floor of 666 for a rare already 3) @fantomlanterns will sell out of the 6666 mints quickly. I bet this turns out to be the  @BoredApeYC  of $ftm  https://twitter.com/PortalJumpNFT/status/1444800681563545602…",2,6,17
https://twitter.com/GotrillaGorilla/status/1445821411700973571,@GotrillaGorilla,2021-10-06T18:41:01.000Z,Feels good to be back in my ape skin! S/O  @nftykc  for hooking me up with  @Chiefs  edit!! Yo  @PatrickMahomes  I think it’s time to join the  @BoredApeYC,2,2,17
https://twitter.com/Ali3n_Mafia/status/1445819744834109440,@Ali3n_Mafia,2021-10-06T18:34:23.000Z,Welcome Home MAYC ima take good care of you. Thank you  @NeonApesYC  for the First Ever Neon Mutant  @BoredApeYC  Love it! #MAYC,16,14,109
https://twitter.com/Ch3xican/status/1445815853547606016,@Ch3xican,2021-10-06T18:18:56.000Z," @skvllpvnkz  is definitely a community you want to be in!!! ",0,3,7
https://twitter.com/Asleepatthewhe1/status/1445815597170761731,@Asleepatthewhe1,2021-10-06T18:17:54.000Z,Join the #skvllfam,0,2,6
https://twitter.com/Walshy_Eth/status/1445814248911802368,@Walshy_Eth,2021-10-06T18:12:33.000Z,"The same thing happened to me one time, but I was sleeping in a hammock, and woke up to the news that I was now on acid.",1,0,10
https://twitter.com/SeizeTheMonkey/status/1445813876575121409,@SeizeTheMonkey,2021-10-06T18:11:04.000Z,"With other prices pumping & BAYC remaining stagnant, just setting up for people to flip big wins on other projects into Apes & then Apes pop.",1,0,6
https://twitter.com/Lambo_Whale/status/1445811524065497089,@Lambo_Whale,2021-10-06T18:01:43.000Z,"I was buying  @LowEffortPunks  while y’all were minting  @BoredApeYC    Did I miss out on a huge bull run, yes.   Although, this is a huge opportunity to get in while Leps are still only a .01 floor.  Time stamps matter in #NFT world.",0,2,25
https://twitter.com/DeFiStaker/status/1445811334059286529,@DeFiStaker,2021-10-06T18:00:58.000Z,oh hell ya  @BoredApeYC,0,1,9
https://twitter.com/professorNFT/status/1445808054012768257,@professorNFT,2021-10-06T17:47:56.000Z,@BoredApeYC  Yesterday I became a doctor!!! I also received all of my merch :) It was a good day! Can I get some love  #bayc #apefollowape,180,72,1270
https://twitter.com/DeLaApe/status/1445807631440891906,@DeLaApe,2021-10-06T17:46:15.000Z,"Guy in the hardware store saw my Ape merch and said ""maaaaaaaaaaan you got a bored ape?!"" WAGMI  @BoredApeYC  #BoredApes #BoredApeYachtClub  @boredapebot",22,19,353
https://twitter.com/mikeshinoda/status/1445806789241434114,@mikeshinoda,2021-10-06T17:42:55.000Z,That’s my boy,3,3,32
https://twitter.com/themintelangelo/status/1445804736351928320,@themintelangelo,2021-10-06T17:34:45.000Z,People are seeing toadz go up like 5-10x in a day and feelin' FOMO.. but yes weak hand shakeout is healthy for a blue chip project,1,0,5
https://twitter.com/brycebanderson/status/1445804586648756224,@brycebanderson,2021-10-06T17:34:09.000Z,So what makes $fomo worth $140 USD in gas?,0,0,11
https://twitter.com/RZucc0/status/1445803960674263042,@RZucc0,2021-10-06T17:31:40.000Z,"#WickedBoneClub",0,2,6
https://twitter.com/Blockimus/status/1445802475244724224,@Blockimus,2021-10-06T17:25:46.000Z,You coming to write history with us?,0,0,13
https://twitter.com/AveAzure/status/1445801634878017539,@AveAzure,2021-10-06T17:22:26.000Z,"I am a big fan of BAYC and own MAYC/BAKC, so genuine question here...but isn't the purpose of Bored Apes, first and foremost, as art and community? The founders don't owe a duty to make sure the floor price rises.  It's not a like it's a stock on the NYSE or Nasdaq",1,0,5
https://twitter.com/0xClawd/status/1445801368048979969,@0xClawd,2021-10-06T17:21:22.000Z,Most of the people who are concerned are over leveraged or flippers. I have plenty of patience,0,0,5
https://twitter.com/qbpick/status/1445801350839758851,@qbpick,2021-10-06T17:21:18.000Z,"Access to  @BoredApeYC  for 4 eth , even at a ""tiered level""...there's no better blue chip bargain right now...damn right I have a bag#MAYC",2,5,25
https://twitter.com/SlimGrim5/status/1445798797464928262,@SlimGrim5,2021-10-06T17:11:09.000Z,"I think our smaller size makes it a little more tight-knit, both communities support each other but the gang is known for showing up and being loud even though we have less holders ",0,0,6
https://twitter.com/jeffalomaniac/status/1445796943033036806,@jeffalomaniac,2021-10-06T17:03:47.000Z,done.,1,0,8
https://twitter.com/dingalingts/status/1445796260947001351,@dingalingts,2021-10-06T17:01:04.000Z,,2,1,31
https://twitter.com/tiltdfs/status/1445795049107701760,@tiltdfs,2021-10-06T16:56:15.000Z,gutter shit:  @GutterCatGang,0,0,4
https://twitter.com/vitoTK/status/1445794506574606337,@vitoTK,2021-10-06T16:54:06.000Z,storytelling:  @all_smilesss,1,0,6
https://twitter.com/danielson_eth/status/1445794443349561351,@danielson_eth,2021-10-06T16:53:51.000Z,I like it. The stagnant floor means it’s a more accessible price point to new buyers and so hopefully it can continue to shake out flippers and replace with new members!,2,0,16
https://twitter.com/OG_CryptoVilla/status/1445793736399540228,@OG_CryptoVilla,2021-10-06T16:51:02.000Z,"Apes shouldn’t worry. Apes seem like NFT stablecoin ATM. Apeless degens still trying to get hands on an ape. Gonna need some hard hitters, millionaires to start moving up that floor. They’ll come.",1,0,6
https://twitter.com/ZsMann/status/1445793693932339200,@ZsMann,2021-10-06T16:50:52.000Z,Imagine having the nerve to complain about a 40e floor...,0,0,5
https://twitter.com/Straica17/status/1445793036332634114,@Straica17,2021-10-06T16:48:16.000Z,@BullieverIsland $BULL #COBI,0,5,4
https://twitter.com/sepsauce/status/1445792960595914754,@sepsauce,2021-10-06T16:47:57.000Z,I think a lot of people gonna look back at this time and wish they bought a mutant ape at this price.  @BoredApeYC,0,0,13
https://twitter.com/homieeth_/status/1445792842794799111,@homieeth_,2021-10-06T16:47:29.000Z,"My take: people want st gains and fail to see that bayc isn't building a nft project to pump the floor. They're building a global lifestyle brand, with our apes at the centre of it. Long-term, I see the dao brand equity being worth billions, and Apes sharing in this. I'm in.",1,0,4
https://twitter.com/5280ross/status/1445792012452569090,@5280ross,2021-10-06T16:44:11.000Z,I'm not sure why people are concerned with  @BoredApeYC  price action & lack of 2.0 Roadmap details. This team has overdelivered every step of the way & will continue to do so in phase 2.0.  Punks had a lull in price action as Apes pumped earlier this year. Where are Punks now?,24,16,247
https://twitter.com/DrDicatrio/status/1445791459307757575,@DrDicatrio,2021-10-06T16:42:00.000Z,my man Pop!,0,0,9
https://twitter.com/PopWonderNFT/status/1445790033240215561,@PopWonderNFT,2021-10-06T16:36:20.000Z,,2,0,22
https://twitter.com/c8ake/status/1445789745099988995,@c8ake,2021-10-06T16:35:11.000Z,the  @BoredApeYC  team arent the ones making me nervous...  ...its the 'community members' constantly worried about floor price.    Thats not how these things work  Kongz are Kongz because of Kongz Punks are Punks because of Punks  They dont rely on constant updates,0,0,6
https://twitter.com/fudmaster_nft/status/1445788904293081089,@fudmaster_nft,2021-10-06T16:31:50.000Z,"Nope. Solana is just an hype. If you think all that money invested in NFT and Defi in Ethereum is moving elsewhere, I really don't think so.",2,0,7
https://twitter.com/FerriswheelFi/status/1445788491498065920,@FerriswheelFi,2021-10-06T16:30:12.000Z,"Generative NFTs have been the talk of the town   There are only a few weeks until a few lucky winners will be able to claim some tasty MealDrops   From  @Cryptokitties  to  @BoredApeYC , discover the journey of gNFTs so far  - https://coinburp.medium.com/the-rise-of-generative-nfts-491a8bcfc75c…  #NFT #NFTs #DeFi",5,41,58
https://twitter.com/W1ll1amEth/status/1445788104430796805,@W1ll1amEth,2021-10-06T16:28:40.000Z,We are in that moment between movie releases. First episode was and now we wait for the sequel.    Could lose ground a bit now but ultimately end up way higher.  Long term #bayc holders are sitting pretty in longs.,0,0,5
https://twitter.com/NFTxExplore/status/1445786426272935937,@NFTxExplore,2021-10-06T16:22:00.000Z,I don’t view it as us v. them. Two kick a$$ communities and one awesome NFT family. That’s my take.,0,0,5
https://twitter.com/GenesisBlocks/status/1445786401853771781,@GenesisBlocks,2021-10-06T16:21:54.000Z,Gm genesis block family! Did you see what we acquired yesterday? We’re in some amazing communities now with these NFTs!   Let’s see who the strongest community is from the NFTs we bought! @coolcatsnft  @BoredApeYC  @worldofwomennft    Vote Below!  #NFTCommmunity,1,11,18
https://twitter.com/FreekyCrypto/status/1445785155596165121,@FreekyCrypto,2021-10-06T16:16:57.000Z,"Explain the roadmap in words and actions would imply that floor price is an important thing for the project. Which I feel is the very first distinctive thing with BAYC, and I´m so cool about it Leave floor price behind, focus on delivering. And they always overdelivered.. my 2cts",1,0,8
https://twitter.com/3LAU/status/1445784743765680131,@3LAU,2021-10-06T16:15:18.000Z,,3,0,9
https://twitter.com/SlamDiegoZoo/status/1445783120037310464,@SlamDiegoZoo,2021-10-06T16:08:51.000Z,"Apes have always had a healthy ebb and flow. Next leg up will happen via Ape Fest. Stay Patient. Stay Bored ",1,0,12
https://twitter.com/RickBakas/status/1445780584727412745,@RickBakas,2021-10-06T15:58:47.000Z,Do you think the entire Eth ecosystem is hurting from gas fees? Solana seems to be the Eth killler everyone said it would be,8,0,7
https://twitter.com/mrjosco/status/1445780224608595971,@mrjosco,2021-10-06T15:57:21.000Z,"I wouldn’t describe myself as “anxious”, I would say “restless”. I trust the team and am not focused on floor price… but I am competitive and want don’t want to see BAYC passed by other projects. Roadmap 2.0 has yet to be released, honestly - what they released was just a teaser",1,0,13
https://twitter.com/fanubo/status/1445780088780324872,@fanubo,2021-10-06T15:56:49.000Z,Isn't it possible they're waiting to do exactly that at the giant party they have planned in a couple weeks?,2,0,16
https://twitter.com/gusba89/status/1445778832963690503,@gusba89,2021-10-06T15:51:49.000Z,"Just got a couple  @GenAlchemyLab    Really digging these  @BoredApeYC  derivatives ",8,11,42
https://twitter.com/Shawnthemon/status/1445777146832506881,@Shawnthemon,2021-10-06T15:45:07.000Z,Have you taken a look at RCRDSHP yet ? Don't remember if I've seen any tweets. Really loving the community there and artists are heavily involved. Not my type of music but the community has roped me in,1,0,6
https://twitter.com/topshotfund/status/1445776525589028868,@topshotfund,2021-10-06T15:42:39.000Z,"the  NFT list by category   digital collectibles:  @larvalabs gaming:  @AxieInfinity   land:  @decentraland   sports:  @dapperlabs   digital art:  @beeple   music:  @3LAU   generative art:  @artblocks_io PFPs:  @BoredApeYC   photography: ",20,22,166
https://twitter.com/NFTMantra/status/1445776277130993667,@NFTMantra,2021-10-06T15:41:40.000Z,Huge respect to both both but the  @GutterCatGang  has dang gutter vibes   #GangGang,0,0,6
https://twitter.com/heckman_eth/status/1445774341480669194,@heckman_eth,2021-10-06T15:33:58.000Z,"Would love nothing more than a collab between these 2…kinda like what’s going on in the leopard/cheetah discord ",1,0,17
https://twitter.com/jbondwagon/status/1445773359103418377,@jbondwagon,2021-10-06T15:30:04.000Z,"Welcome a bored,  @jamievernon ! Wen  @joerogan ?",0,1,11
https://twitter.com/PieterWeb3/status/1445772886560501760,@PieterWeb3,2021-10-06T15:28:11.000Z,I'm SUPER happy to be in both :) They act differently - which is better than being the same imo :),0,0,5
https://twitter.com/Alejo_CryptoETH/status/1445772417243090949,@Alejo_CryptoETH,2021-10-06T15:26:20.000Z,"@FLSNFT  launch on the 10th , whitelist is almost done .  @BoredApeYC  @cats_agency  holders are whitelisted!!!! #LFG",1,5,10
https://twitter.com/Knuckl3z__/status/1445771687748784139,@Knuckl3z__,2021-10-06T15:23:26.000Z,"Too may people rocking fake apes out here. Initial community size (3k vs 10k) probably formed tighter relationships in #GCG, plus there was a lot of overlap between the two. #GCG is certainly louder on Twitter these days, but I like like most things it comes and goes.",0,1,8
https://twitter.com/NFTfi/status/1445769328427634702,@NFTfi,2021-10-06T15:14:03.000Z,"“I wish I could use my  @BoredApeYC   as a collateral…” “ Imagine the day when…” “ Need an #NFT  loan…”  If only there was a place where all these NFT holders could go to for #NFTloans, right?  Oh wait - there is!  @MisterBoredApe, @TonyaZi27126836,  @AlexWGomezz ,  @0xDIS",0,2,9
https://twitter.com/FishNFT/status/1445764300598091776,@FishNFT,2021-10-06T14:54:04.000Z,Taking the apes to space with us. LFG,0,0,8
https://twitter.com/NFTfinders/status/1445763275493285895,@NFTfinders,2021-10-06T14:50:00.000Z,Hey  @BoredApeYC  @marscatsvoyage  has really outdone themselves here! LOVE IT,3,25,82
https://twitter.com/KygoMusic/status/1445763208095023120,@KygoMusic,2021-10-06T14:49:44.000Z,Congrats bro!,5,2,35
https://twitter.com/lawofthesaw/status/1445761029686784000,@lawofthesaw,2021-10-06T14:41:05.000Z,people accumulating to eventually make it in BAYC.  the apes are here to stay. short term y’all might just have a little dip… but the goal for too many is to join one day,1,0,5
https://twitter.com/brydisanto/status/1445760526332559362,@brydisanto,2021-10-06T14:39:05.000Z,Gang gang baby!,0,0,7
https://twitter.com/grantpat/status/1445758386792845317,@grantpat,2021-10-06T14:30:34.000Z," ",0,0,7
https://twitter.com/TvBombadil/status/1445757925448843274,@TvBombadil,2021-10-06T14:28:44.000Z,Jeez one of the coolest out there tbh!,0,0,3
https://twitter.com/PosseSwamp/status/1445757823648862214,@PosseSwamp,2021-10-06T14:28:20.000Z,we love our ape brothers too but the Gutter is gang ganggggg,0,0,9
https://twitter.com/bazinga_bazi/status/1445756741686153222,@bazinga_bazi,2021-10-06T14:24:02.000Z,Gang Gang  @GutterCatGang  #CooCooo,1,0,5
https://twitter.com/mmwalk/status/1445756306149687303,@mmwalk,2021-10-06T14:22:18.000Z,"I was team ape, but after my pfp switch I saw some crazy movement…. Just timing? Or is gang gang the real deal?",9,1,22
https://twitter.com/DimSumMaxi/status/1445756261073444870,@DimSumMaxi,2021-10-06T14:22:08.000Z,"I think about my ape in terms of months and years, in the context of all the projects being developed around #BAYC by the community (see  @jenkinsthevalet ) and the awesomeness of the founders. Short term price movements are irrelevant. Patience.",1,0,5
https://twitter.com/GWtheLabRat/status/1445755757979332618,@GWtheLabRat,2021-10-06T14:20:08.000Z,"100p, no one supports their fellow gang members like the gutter!",1,0,7
https://twitter.com/wabdoteth/status/1445754643716325384,@wabdoteth,2021-10-06T14:15:42.000Z," ",0,1,5
https://twitter.com/JBurg11/status/1445754640205680649,@JBurg11,2021-10-06T14:15:41.000Z,What about the Lions KING? #ROAR,0,0,6
https://twitter.com/EmpyreanFoxSage/status/1445749310688141321,@EmpyreanFoxSage,2021-10-06T13:54:31.000Z,"My collection  @NNSNFT  first series ""Ape Brains"" birthed from the concept of my  @galaxy_eggs  and @AlohaApeGang  @BoredApeYC , will be releasing a total of 15 hand drawn animated records that combined with an original track loop. #NFTs #NFT #NFTCommunity  https://opensea.io/collection/nonamestudios…",0,2,6
https://twitter.com/metaboom_nft/status/1445744024447377410,@metaboom_nft,2021-10-06T13:33:30.000Z,"GM! Here’s a limited edition MetaBoom inaugural beats for  @JLukevich . tape will work with boombox later. Hope you like it and RT, we’ll drop a blind box to you as a thank-you! @BoredApeYC  #ApesTogetherStrong",1,3,15
https://twitter.com/TacitaToons/status/1445743328180326405,@TacitaToons,2021-10-06T13:30:44.000Z,"As always, zoom in. The text is slightly different from the text on the cat's suits :)",1,0,7
https://twitter.com/TokenHunt/status/1445743163985907724,@TokenHunt,2021-10-06T13:30:05.000Z,"""Boring Stone"" is about to rock the #metaverse  A group of community members from Blockchain & Booze,  @BoredApeYC , and  @fame_ladies  have formed ""http://NFT.FAMILY"" to launch a collaborative #NFTproject called the Genesis collection!   Details ",0,2,10
https://twitter.com/rekt2160/status/1445734032126320652,@rekt2160,2021-10-06T12:53:48.000Z,"Let’s go ",0,0,5
https://twitter.com/YesInvestOff/status/1445729568460054531,@YesInvestOff,2021-10-06T12:36:04.000Z,"People will read this and do nothing, then complain they missed out in a few weeks",0,1,6
https://twitter.com/HoneyFarmFi/status/1445724283104235525,@HoneyFarmFi,2021-10-06T12:15:04.000Z,"NFT Jelly Round 1 #MAYC #1553 Winner Announcement  We have a winner for Mutant Ape Yacht Club NFT! https://moon.honeyfarm.finance/nftjelly  MAYC Floor Price at 4ETH ($13,573) Congratulations to this lucky HoneyBeez! #DeFi #NFT  @BoredApeYC  #BAYC #NFTGiveaway",1,2,12
https://twitter.com/ath_thaariq/status/1445723560840814609,@ath_thaariq,2021-10-06T12:12:11.000Z,Time to suit up  @marscatsvoyage  @BoredApeYC   #NFTs #NFTCommunity #nftcollector,0,1,9
https://twitter.com/HenryTheGrape/status/1445720140713238528,@HenryTheGrape,2021-10-06T11:58:36.000Z,A few thoughts for my  @CyberKongz  friends and those sitting on the sideline. 1. $BANANA is at $116...nuff said 2. Cyberkongz babies will flip  @BoredApeYC   3. Cyberkongz VX are still way undervalued. !oohmen  #NFA #DYOR #NFTs,9,32,147
https://twitter.com/spygea84228/status/1445713555412582402,@spygea84228,2021-10-06T11:32:26.000Z,so sick! @BoredApeYC  #MAYC #MCV,1,8,37
https://twitter.com/BootyStuff69/status/1445705279174168591,@BootyStuff69,2021-10-06T10:59:33.000Z,"Broke up with my gf, started law school, moved out and took on some loans. My goal for the next year is to work my way to become a  @BoredApeYC  hodler",1,0,8
https://twitter.com/marscatgazette/status/1445690351365201923,@marscatgazette,2021-10-06T10:00:14.000Z,Apes said they were bored on Earth  @marscatsvoyage   has decided to send apes into space!  @BoredApeYC  CATS friends with APES. >>  #wenmars #mcv,1,3,13
https://twitter.com/awakenjian/status/1445688204422615041,@awakenjian,2021-10-06T09:51:42.000Z,@BoredApeYC  @marscatsvoyage   #WenMars  #ReadyForLaunch,4,17,64
https://twitter.com/CryptoDiamonds/status/1445685376929067010,@CryptoDiamonds,2021-10-06T09:40:28.000Z,"Unpopular Opinion:  Just like the minting of the  @BoredApeYC  Mutants  marked the top of the first #NFT wave of 2021, it is possible that the upcoming  @MekaVerse  mint will mark the top of the second.  #NFTs are here to stay, but right now is a great spot to be taking some profits.",0,4,10
https://twitter.com/StanniNft/status/1445676444730806281,@StanniNft,2021-10-06T09:04:58.000Z,you are not in BAYC? best time to buy an ape people are looking for liquidite to shop in moon projects. waiting for the next news don't miss the train  @BoredApeYC,1,0,28
https://twitter.com/flydragonfly8/status/1445658330043588615,@flydragonfly8,2021-10-06T07:52:59.000Z,"I think  @nft2040  has mad potential adding a new way of utility to metaverse ready NFT's, what do you think of   playing to earn with your  @BoredApeYC  @allnick  ? Exited to see  @BoredApeYC  @ImmaDegen  @MeebitsDAO  & more can earn $ETH in this fun way. NFT interoperability is here!",7,12,31
https://twitter.com/Last_Come_First/status/1445644919238848515,@Last_Come_First,2021-10-06T06:59:42.000Z," Meet my boy  @NFtSNiPERbOt  's new house payment @jaylenecook__  @garyvee  @LynxXAU  @GoblinLabNFT  @BlazedCat5933 @vaynernft  @TomBilyeu  @ZssBecker  @adamsbucket  @fifirong  @famous_dyl  @DynastyFrank  @nftminter  @JamsonsNFTs  @BoredApeYC    #BoredApeYachtClub #NFTs #nftcollector",1,3,7
https://twitter.com/MrStats_/status/1445637363577724930,@MrStats_,2021-10-06T06:29:40.000Z,I mute everyone that shills a project on an unrelated tweet,0,0,1
https://twitter.com/Spawn_Sats/status/1445634799356444676,@Spawn_Sats,2021-10-06T06:19:29.000Z,"Rockin the new #BAYC  @BoredApeYC  x  @thehundreds  gear… No one even asked to see my ape ",0,2,10
https://twitter.com/BAYC1K/status/1445634487627378695,@BAYC1K,2021-10-06T06:18:15.000Z,Just followed him back. Welcome to the Ape fam :-),2,1,6
https://twitter.com/jjabram19/status/1445631875842600965,@jjabram19,2021-10-06T06:07:52.000Z,"sup, all festive :) https://niftytailor.com  Works for  @RealSupDucks  @BoredApeYC  @MutantApeBot  @coolcatsnft  @LazyLionsNFT  @AdamBombSquad",0,3,6
https://twitter.com/MikeEstacio/status/1445631124235907078,@MikeEstacio,2021-10-06T06:04:53.000Z,Can  @BoredApeMC  holders get sued by  @BoredApeYC  holders over rights infringement? #BAYC #bamc #nft,2,0,6
https://twitter.com/DCLBlogger/status/1445630071008493576,@DCLBlogger,2021-10-06T06:00:42.000Z,"13/ An ambitious roadmap as seen on  @BoredApeYC (Twitter didn't let me upload the whole roadmap wth).  Anyway, mobile games, physical meetups, DAO, etc. We know they are extremely well funded!",1,3,46
https://twitter.com/JpegGems/status/1445629827478786052,@JpegGems,2021-10-06T05:59:44.000Z,"We are giving away 1 floor-priced official Bored Ape Yacht Club NFT from  @BoredApeYC    Enter to win:  Follow @Symmetrical_NFT   Like, retweet & tag 3 friends on this tweet  Join our Discord:    → http://discord.gg/dx7pJTGkSU  Go to the moon with us!",44,282,281
https://twitter.com/mrblock_com/status/1445627565155106822,@mrblock_com,2021-10-06T05:50:44.000Z,"Loving the bungalow Metaverse vibes #roar  how are y’all showcasing your other NFTs, what do y’all think?  @LazyLionsNFT  @roguesocietynft  @CryptoCannaClub  @BoredApeYC  @TheProjectURS  @BlankFaceNFT  @ChibiLabs  @U_UnicornsNFT  @youngandsick   @robotosNFT",1,0,9
https://twitter.com/bragtome/status/1445620550504648715,@bragtome,2021-10-06T05:22:52.000Z,Look at that.... Shirt. Very nice!,0,0,7
https://twitter.com/apelicious55/status/1445611032504782853,@apelicious55,2021-10-06T04:45:02.000Z,Love this project!,2,2,5
https://twitter.com/peterjfang/status/1445610193832734728,@peterjfang,2021-10-06T04:41:43.000Z,The Godfather's Ape made it onto another cover  @BoringStoneNFT  @BoredApeYC  @TheeHustleHouse,0,7,25
https://twitter.com/Halodrift/status/1445599591374549001,@Halodrift,2021-10-06T03:59:35.000Z,"I was probably the first few to follow  @BoredApeYC  on twitter (they follow me back) and discord before launch, that was just 1 or 2d after learning about NFTs. I had almost zero knowledge on NFTs and just watched people spend ETH on jpegs and not mint my first NFT. ",3,1,18
https://twitter.com/michaelgmcquaid/status/1445593670531502086,@michaelgmcquaid,2021-10-06T03:36:03.000Z,Keep seeing people who own multiple  @BoredApeYC ’s buying @WannaPandaNFT which just revealed today. Perhaps they have a good sense for future successful pfp #nfts.   Probably nothing …   #wannapanda #nftcollector #NFTCommunity #bayc ￼,5,18,43
https://twitter.com/jaypegsonly/status/1445587950721396737,@jaypegsonly,2021-10-06T03:13:19.000Z,"As much as I love  @BoredApeYC  and I would love to own one, at this time a ~40e investment in a BAYC isn’t worth it given how much more incremental value other new projects are generating for your ETH  See @coolcatsnft  @cryptoadzNFT  and  @creatureNFT  for eg, much better plays imo",1,0,12
https://twitter.com/theryanparshall/status/1445586412913364998,@theryanparshall,2021-10-06T03:07:13.000Z,Get Kygo to headline Big Sky Fest - put on by  @bigskynft  in June 2022,1,3,11
